evidence_id,source_id,doi,taxon,lineage_id,analysis_group,group_confidence,comparison_id,comparison_units,trait_id,trait_family,reported_direction,numeric_status,value,value_unit,n,variance,pollinator_regime,geographic_mapping_status,source_locator,verification_status,scoring_status,claim,notes
ligustrum-2014-corolla-izu,ligustrum_yamada_2014,10.1111/boj.12092,Ligustrum ovalifolium,ligustrum_ovalifolium,generalist,medium,mainland_honshu_vs_izu_islands,"mainland Honshu versus Izu Islands as defined in the paper",corolla_tube_length,floral_size,decrease,qualitative_only,,,,,,unmapped_source_native,"publisher abstract; full article table/location map not yet transcribed",publisher_abstract_verified,not_scoreable,"The publisher abstract reports shorter corolla tubes in Izu than mainland populations.",Do not map this source-native contrast to a first or second pollinator transition until the named island/locality table is transcribed.
ligustrum-2014-stamen-izu,ligustrum_yamada_2014,10.1111/boj.12092,Ligustrum ovalifolium,ligustrum_ovalifolium,generalist,medium,mainland_honshu_vs_izu_islands,"mainland Honshu versus Izu Islands as defined in the paper",stamen_length,floral_size,decrease,qualitative_only,,,,,,unmapped_source_native,"publisher abstract; full article table/location map not yet transcribed",publisher_abstract_verified,not_scoreable,"The publisher abstract reports shorter stamens in Izu than mainland populations.",Do not map this source-native contrast to a first or second pollinator transition until the named island/locality table is transcribed.
ligustrum-2014-hachijo-shortening,ligustrum_yamada_2014,10.1111/boj.12092,Ligustrum ovalifolium,ligustrum_ovalifolium,generalist,medium,other_izu_vs_hachijo,"other Izu populations versus Hachijo as defined in the paper",floral_shortening_intensity,floral_size,decrease,qualitative_only,,,,,,needs_locality_table,"publisher abstract; full article table/location map not yet transcribed",publisher_abstract_verified,not_scoreable,"The publisher abstract reports that floral shortening was stronger on Hachijo.",The sign is recorded relative to the source contrast only; it is not treated as a numeric effect size.
ligustrum-2014-hachijo-pollinators,ligustrum_yamada_2014,10.1111/boj.12092,Ligustrum ovalifolium,ligustrum_ovalifolium,generalist,medium,other_izu_vs_hachijo,"other Izu populations versus Hachijo as defined in the paper",pollinator_fauna,pollinator_context,non_directional_difference,qualitative_only,,,,,,needs_locality_table,"publisher abstract; full article table/location map not yet transcribed",publisher_abstract_verified,not_scoreable,"The publisher abstract reports Hachijo pollinator fauna differed significantly from other Izu and mainland Honshu.",Contextual evidence only; no photo score or pollinator effectiveness is imputed.
weigela-2010-pending,weigela_yamada_2010,10.1007/s00606-010-0317-y,Weigela coraeensis,weigela_coraeensis,specialist,medium,pending_table_extraction,"mainland and island populations; exact locality units pending original table",pending_extraction,pending,not_extracted,,,,,,needs_locality_table,"full article table and locality map required",metadata_verified,not_scoreable,"Article title identifies floral differentiation among insular and mainland populations.",No trait direction or numerical value is entered until original results tables/figures and locality mapping are inspected.
clerodendrum-2012-excluded,clerodendrum_mizusawa_2012,10.1111/j.1442-1984.2012.00385.x,Clerodendrum izuinsulare,clerodendrum_izuinsulare,excluded,source_native_between_taxa,between_taxa,"insular C. izuinsulare versus widespread congener C. trichotomum",pollination_comparison,excluded,not_applicable,not_extracted,,,,,,unmapped_source_native,"title/abstract scope review",metadata_verified,excluded_comparator,"Comparison is between distinct taxa rather than within-species mainland/island populations.",Retained as contextual natural-history evidence only; excluded from within-lineage prediction meta-analysis.
